<?xml version="1.0" encoding="UTF-8"?>
<!--
   Copyright 2012 Otavio Rodolfo Piske

   Licensed under the Apache License, Version 2.0 (the "License");
   you may not use this file except in compliance with the License.
   You may obtain a copy of the License at

       http://www.apache.org/licenses/LICENSE-2.0

   Unless required by applicable law or agreed to in writing, software
   distributed under the License is distributed on an "AS IS" BASIS,
   WITHOUT WARRANTIES OR CONDITIONS OF ANY KIND, either express or implied.
   See the License for the specific language governing permissions and
   limitations under the License.
 -->

<dbm xmlns="http://www.orpiske.net/ssps/dbm" xmlns:xsi="http://www.w3.org/2001/XMLSchema-instance" xsi:schemaLocation="http://www.orpiske.net/ssps/dbm dbm.xsd ">
  <!-- This is a sample file -->
  <project>
    <name>org.mygroup</name>
    <name>sample</name>
    <version>1.0.0</version>
  </project>
  <build>
    <artifact>
    	<name>${name}-${version}-bin.tar.bz2</name>	
    </artifact>
  </build>
</dbm>
